{
  "version": "v1",
  "source": {
    "title": "Keputusan Kepala Badan Standar, Kurikulum, dan Asesmen Pendidikan Kementerian Pendidikan Dasar dan Menengah Nomor 046/H/KR/2025 tentang Capaian Pembelajaran pada Pendidikan Anak Usia Dini, Jenjang Pendidikan Dasar, dan Jenjang Pendidikan Menengah",
    "decree": "046/H/KR/2025",
    "set": "2025-07-16",
    "amendedBy": "Keputusan Kepala BKPDM Nomor 020 Tahun 2026 (Agama dan Budi Pekerti only; not included here)",
    "pdfSha256": "86beda147795100e5d79801b8440f82d4a7f5503470f2379dd1b4dd76173180c",
    "note": "Verbatim text of Lampiran II, Fase A–C, extracted with pdftotext. Images and tables inside the decree are not captured. Government decrees carry no copyright under UU 28/2014 Pasal 42."
  },
  "mapel": [
    {
      "code": "ppkn",
      "name": "Pendidikan Pancasila",
      "section": "II",
      "elemen": [
        {
          "code": "pancasila",
          "name": "Pancasila"
        },
        {
          "code": "uud",
          "name": "Undang-Undang Dasar Negara Republik Indonesia Tahun 1945"
        },
        {
          "code": "bti",
          "name": "Bhinneka Tunggal Ika"
        },
        {
          "code": "nkri",
          "name": "Negara Kesatuan Republik Indonesia"
        }
      ]
    },
    {
      "code": "bind",
      "name": "Bahasa Indonesia",
      "section": "III.1",
      "elemen": [
        {
          "code": "simak",
          "name": "Menyimak"
        },
        {
          "code": "baca",
          "name": "Membaca dan Memirsa"
        },
        {
          "code": "bicara",
          "name": "Berbicara dan Mempresentasikan"
        },
        {
          "code": "tulis",
          "name": "Menulis"
        }
      ]
    },
    {
      "code": "mat",
      "name": "Matematika",
      "section": "IV.1",
      "elemen": [
        {
          "code": "bil",
          "name": "Bilangan"
        },
        {
          "code": "alj",
          "name": "Aljabar"
        },
        {
          "code": "ukur",
          "name": "Pengukuran"
        },
        {
          "code": "geo",
          "name": "Geometri"
        },
        {
          "code": "data",
          "name": "Analisis Data dan Peluang"
        }
      ]
    },
    {
      "code": "bing",
      "name": "Bahasa Inggris",
      "section": "V.1",
      "elemen": [
        {
          "code": "simak-bicara",
          "name": "Menyimak - Berbicara (Listening - Speaking)"
        },
        {
          "code": "baca",
          "name": "Membaca - Memirsa (Reading - Viewing)"
        },
        {
          "code": "tulis",
          "name": "Menulis - Mempresentasikan (Writing - Presenting)"
        }
      ]
    },
    {
      "code": "ipas",
      "name": "Ilmu Pengetahuan Alam dan Sosial (IPAS)",
      "section": "VI",
      "elemen": [
        {
          "code": "paham",
          "name": "Pemahaman IPAS"
        },
        {
          "code": "proses",
          "name": "Keterampilan Proses"
        }
      ]
    },
    {
      "code": "seni-musik",
      "name": "Seni Musik",
      "section": "XVIII.1",
      "elemen": [
        {
          "code": "alami",
          "name": "Mengalami (Experiencing)"
        },
        {
          "code": "refleksi",
          "name": "Merefleksikan (Reflecting)"
        },
        {
          "code": "artistik",
          "name": "Berpikir dan Bekerja Artistik (Thinking and Working Artistically)"
        },
        {
          "code": "cipta",
          "name": "Menciptakan (Making/Creating)"
        },
        {
          "code": "dampak",
          "name": "Berdampak (Impacting)"
        }
      ]
    },
    {
      "code": "seni-rupa",
      "name": "Seni Rupa",
      "section": "XVIII.2",
      "elemen": [
        {
          "code": "alami",
          "name": "Mengalami (Experiencing)"
        },
        {
          "code": "refleksi",
          "name": "Merefleksikan (Reflecting)"
        },
        {
          "code": "artistik",
          "name": "Berpikir dan Bekerja Artistik (Thinking and Working Artistically)"
        },
        {
          "code": "cipta",
          "name": "Menciptakan (Making/Creating)"
        },
        {
          "code": "dampak",
          "name": "Berdampak (Impacting)"
        }
      ]
    },
    {
      "code": "seni-tari",
      "name": "Seni Tari",
      "section": "XVIII.3",
      "elemen": [
        {
          "code": "alami",
          "name": "Mengalami (Experiencing)"
        },
        {
          "code": "refleksi",
          "name": "Merefleksikan (Reflecting)"
        },
        {
          "code": "artistik",
          "name": "Berpikir dan Bekerja Artistik (Thinking and Working Artistically)"
        },
        {
          "code": "cipta",
          "name": "Menciptakan (Making/Creating)"
        },
        {
          "code": "dampak",
          "name": "Berdampak (Impacting)"
        }
      ]
    },
    {
      "code": "seni-teater",
      "name": "Seni Teater",
      "section": "XVIII.4",
      "elemen": [
        {
          "code": "alami",
          "name": "Mengalami (Experiencing)"
        },
        {
          "code": "refleksi",
          "name": "Merefleksikan (Reflecting)"
        },
        {
          "code": "artistik",
          "name": "Berpikir dan Bekerja Artistik (Thinking and Working Artistically)"
        },
        {
          "code": "cipta",
          "name": "Menciptakan (Making/Creating)"
        },
        {
          "code": "dampak",
          "name": "Berdampak (Impacting)"
        }
      ]
    },
    {
      "code": "pjok",
      "name": "Pendidikan Jasmani, Olahraga, dan Kesehatan",
      "section": "XXI",
      "elemen": [
        {
          "code": "gerak",
          "name": "Terampil Bergerak"
        },
        {
          "code": "belajar-gerak",
          "name": "Belajar Melalui Gerak"
        },
        {
          "code": "aktif",
          "name": "Bergaya Hidup Aktif"
        },
        {
          "code": "sehat",
          "name": "Memilih Hidup yang Menyehatkan"
        }
      ]
    },
    {
      "code": "kka",
      "name": "Koding dan Kecerdasan Artifisial",
      "section": "XXVIII",
      "elemen": [
        {
          "code": "komputasional",
          "name": "Berpikir Komputasional"
        },
        {
          "code": "digital",
          "name": "Literasi Digital"
        },
        {
          "code": "etika-ka",
          "name": "Literasi dan Etika Kecerdasan Artifisial"
        },
        {
          "code": "manfaat-ka",
          "name": "Pemanfaatan dan Pengembangan Kecerdasan Artifisial"
        }
      ]
    }
  ],
  "standards": [
    {
      "id": "cp046.ppkn.A.pancasila",
      "mapel": "ppkn",
      "fase": "A",
      "kelas": [
        1,
        2
      ],
      "elemen": "Pancasila",
      "elemenCode": "pancasila",
      "text": "Mengenal bendera negara, lagu kebangsaan, simbol dan sila-sila Pancasila dalam lambang negara Garuda Pancasila dan simbol Pancasila beserta sila-sila Pancasila; menerapkan nilai-nilai Pancasila di lingkungan keluarga.",
      "source": {
        "decree": "046/H/KR/2025",
        "lampiran": "II",
        "section": "II.D.1.1"
      }
    },
    {
      "id": "cp046.ppkn.A.uud",
      "mapel": "ppkn",
      "fase": "A",
      "kelas": [
        1,
        2
      ],
      "elemen": "Undang-Undang Dasar Negara Republik Indonesia Tahun 1945",
      "elemenCode": "uud",
      "text": "Mengenal aturan di lingkungan keluarga; menunjukkan dan menceritakan sikap mematuhi aturan di lingkungan keluarga.",
      "source": {
        "decree": "046/H/KR/2025",
        "lampiran": "II",
        "section": "II.D.1.2"
      }
    },
    {
      "id": "cp046.ppkn.A.bti",
      "mapel": "ppkn",
      "fase": "A",
      "kelas": [
        1,
        2
      ],
      "elemen": "Bhinneka Tunggal Ika",
      "elemenCode": "bti",
      "text": "Mengenal semboyan Bhinneka Tunggal Ika; mengidentifikasi dan menghargai identitas dirinya sesuai dengan jenis kelamin, hobi, bahasa, serta agama dan kepercayaan di lingkungan sekitar.",
      "source": {
        "decree": "046/H/KR/2025",
        "lampiran": "II",
        "section": "II.D.1.3"
      }
    },
    {
      "id": "cp046.ppkn.A.nkri",
      "mapel": "ppkn",
      "fase": "A",
      "kelas": [
        1,
        2
      ],
      "elemen": "Negara Kesatuan Republik Indonesia",
      "elemenCode": "nkri",
      "text": "Mengenal karakteristik lingkungan tempat tinggal dan sekolah, sebagai bagian dari wilayah Negara Kesatuan Republik Indonesia; menceritakan dan mempraktikkan bekerja sama menjaga lingkungan sekitar dalam keberagaman.",
      "source": {
        "decree": "046/H/KR/2025",
        "lampiran": "II",
        "section": "II.D.1.4"
      }
    },
    {
      "id": "cp046.ppkn.B.pancasila",
      "mapel": "ppkn",
      "fase": "B",
      "kelas": [
        3,
        4
      ],
      "elemen": "Pancasila",
      "elemenCode": "pancasila",
      "text": "Mengidentifikasi makna sila-sila Pancasila, dan penerapannya dalam kehidupan sehari-hari; mengenal karakter para perumus Pancasila; menunjukkan sikap bangga menjadi anak Indonesia yang memiliki bahasa Indonesia sebagai bahasa persatuan di lingkungan sekitar.",
      "source": {
        "decree": "046/H/KR/2025",
        "lampiran": "II",
        "section": "II.D.2.1"
      }
    },
    {
      "id": "cp046.ppkn.B.uud",
      "mapel": "ppkn",
      "fase": "B",
      "kelas": [
        3,
        4
      ],
      "elemen": "Undang-Undang Dasar Negara Republik Indonesia Tahun 1945",
      "elemenCode": "uud",
      "text": "Mengidentifikasi dan melaksanakan aturan di sekolah dan lingkungan tempat tinggal; mengidentifikasi dan menerapkan hak yang didapat dan kewajiban sebagai anggota keluarga dan sebagai warga sekolah.",
      "source": {
        "decree": "046/H/KR/2025",
        "lampiran": "II",
        "section": "II.D.2.2"
      }
    },
    {
      "id": "cp046.ppkn.B.bti",